ProductID,ProductName,ProductSpecification,Category,Voltage,Capacity,CycleLife,Warranty,Weight,Dimensions,OperatingTemp,Application,Featured,ProductImage,ProductImageURL,ShortDescription
1,12V 100AH lifepo4 battery,High-performance LiFePO4 battery for inverter and solar systems,solar-storage,12V,100AH,2000+ cycles,3 Years,11.5kg,330x172x215mm,-20°C to 60°C,Solar Storage & Inverter,yes,12V 100AH lifepo4 battery.webp,,Reliable deep-cycle 12V battery for home and small office backup.
2,12V 55AH lifepo4 deep cycle,Compact deep cycle battery suitable for backup and light solar usage,solar-storage,12V,55AH,2000+ cycles,3 Years,6.5kg,229x138x208mm,-20°C to 60°C,Backup & Solar,yes,12V 55AH lifepo4 deep cycle.webp,,Compact battery for low-space backup setups.
3,12v 6.9ah 360A CCA LiFePO4,High CCA battery designed for motorcycle starting performance,motorcycle,12V,6.9AH,1500+ cycles,2 Years,0.9kg,113x70x85mm,-10°C to 55°C,Motorcycle Starter,yes,12v 6.9ah 360A CCA LiFePO4.webp,,Lightweight high-cranking motorcycle battery.
4,12v 2.3ah 120A CCA battery,Entry-level CCA battery for bikes and scooters,motorcycle,12V,2.3AH,1500+ cycles,2 Years,0.55kg,113x38x85mm,-10°C to 55°C,Scooter & Bike,yes,12v 2.3ah 120A CCA battery.webp,,Compact starter battery for commuter two-wheelers.
5,LFP 12V 100Ah 32650 32700,Advanced 12V lithium battery pack built with 32650/32700 cells,12v-series,12V,100AH,2000+ cycles,3 Years,12kg,330x172x215mm,-20°C to 60°C,UPS & Inverter,yes,LFP 12V 100Ah 32650 32700.webp,,High-quality 12V battery pack for dependable long backup.
6,12.8v 300Ah 3840 Watts,Large-capacity power solution for bigger backup loads,solar-storage,12.8V,300AH,3000+ cycles,3 Years,28kg,520x260x220mm,-20°C to 60°C,Residential & Commercial Solar,yes,12.8v 300Ah 3840 Watts.webp,,High-capacity energy storage for long-duration backup.
7,12.8v 3Ah LiFePO4 battery,Built for solar panel stree light,solar-storage,12.8V,3AH,1500+ cycles,3 Years,0.55kg,113x38x85mm,-10°C to 55°C,Residential & Commercial Solar,yes,12.8v 3Ah LiFePO4 battery.webp,,Lightweight high-cranking motorcycle battery.
8,12v 6.9ah CCA 360A,Built for Motorcycle Starter,motorcycle,12V,360AH,1500+ cycles,3 Years,28kg,520x260x220mm,-20°C to 60°C,Motorcycle Starter,yes,12v 6.9ah CCA 360A.webp,,High-capacity energy storage for long-duration backup.
